{
  "contract": "melo.asset-manifest",
  "contractVersion": "1.0.0",
  "id": "board.dark",
  "version": "1.0.0",
  "kind": "board-skin",
  "origin": "builtin",
  "contentHash": "sha256:ec1e9ebbce94df7380d46518d9c13a6cca13cbd7b05bf9a7dd99e5bb18d3ce13",
  "runtime": {
    "renderers": [
      "fixed-camera-cinematic"
    ],
    "deterministic": true,
    "budget": {
      "textureMemoryMiB": 12,
      "triangleCount": 16000
    }
  }
}
