{
  "contract": "melo.asset-manifest",
  "contractVersion": "1.0.0",
  "id": "look.copper",
  "version": "1.0.0",
  "kind": "look-pack",
  "origin": "generated",
  "contentHash": "sha256:d0d0237c9fe4974ad2b07b29d517f8fffabb4f89ad8a3b4c4344d9e2a6e2d7af",
  "runtime": {
    "renderers": [
      "fixed-camera-cinematic"
    ],
    "deterministic": true
  },
  "slots": {
    "background.base": {
      "id": "background.dark",
      "version": "1.0.0",
      "kind": "background",
      "contentHash": "sha256:35fa8d4c71dd13f7c3cdfe754ec51ef3ebceea0605eefe6e4305d94aa05c965b"
    },
    "board.skin": {
      "id": "board.dark",
      "version": "1.0.0",
      "kind": "board-skin",
      "contentHash": "sha256:ec1e9ebbce94df7380d46518d9c13a6cca13cbd7b05bf9a7dd99e5bb18d3ce13"
    },
    "tile.material": {
      "id": "material.copper",
      "version": "1.0.0",
      "kind": "material-pack",
      "contentHash": "sha256:bf5a60f402f40bbaedde859aa17064718b7766fb2ac697241e9d35bd832cb165"
    },
    "interaction.preview": {
      "id": "preview.default",
      "version": "1.0.0",
      "kind": "animation-asset",
      "contentHash": "sha256:93737e9b65a6ba907d0ab9cadf78b86c80f607b8119dd0691445c60b9064caa5"
    },
    "placement.confirmation": {
      "id": "placement.default",
      "version": "1.0.0",
      "kind": "animation-asset",
      "contentHash": "sha256:4f66d891c7ba1a5e9c943b68daa4846e8de6b48b5a6f83246eb48b1789f2db28"
    },
    "clear.primary": {
      "id": "effect.copper-clear",
      "version": "1.0.0",
      "kind": "effect-pack",
      "contentHash": "sha256:f37932947ffe4a024c44c4a8a2374168b43924dda97ba484e0783a2bdad77562"
    },
    "clear.tile-exit": {
      "id": "clear.exit",
      "version": "1.0.0",
      "kind": "animation-asset",
      "contentHash": "sha256:5e8d2bad9c60ccf77aefd8302673c9796da1e646e5f3bedde365db56098567d2"
    },
    "hud.current-score": {
      "id": "hud.score",
      "version": "1.0.0",
      "kind": "ui-theme",
      "contentHash": "sha256:39e9dca88093bb07f91978a0fe1b60290070644ca3d57cd08b3b84d3c4d19749"
    },
    "endgame.presentation": {
      "id": "endgame.default",
      "version": "1.0.0",
      "kind": "ui-theme",
      "contentHash": "sha256:aa56e09b4f1052a623ed8f5c8ed742094b64cffcf4faea35876e03b18379367c"
    }
  }
}
