{
  "contract": "melo.asset-manifest",
  "contractVersion": "1.0.0",
  "id": "preview.default",
  "version": "1.0.0",
  "kind": "animation-asset",
  "origin": "builtin",
  "contentHash": "sha256:93737e9b65a6ba907d0ab9cadf78b86c80f607b8119dd0691445c60b9064caa5",
  "runtime": {
    "renderers": [
      "fixed-camera-cinematic"
    ],
    "deterministic": true
  }
}
