{
  "contract": "melo.asset-manifest",
  "contractVersion": "1.0.0",
  "id": "endgame.default",
  "version": "1.0.0",
  "kind": "ui-theme",
  "origin": "builtin",
  "contentHash": "sha256:aa56e09b4f1052a623ed8f5c8ed742094b64cffcf4faea35876e03b18379367c",
  "runtime": {
    "renderers": [
      "fixed-camera-cinematic"
    ],
    "deterministic": true
  }
}
