{
  "contract": "melo.asset-manifest",
  "contractVersion": "1.0.0",
  "id": "background.dark",
  "version": "1.0.0",
  "kind": "background",
  "origin": "builtin",
  "contentHash": "sha256:35fa8d4c71dd13f7c3cdfe754ec51ef3ebceea0605eefe6e4305d94aa05c965b",
  "runtime": {
    "renderers": [
      "fixed-camera-cinematic"
    ],
    "deterministic": true,
    "budget": {
      "textureMemoryMiB": 8
    }
  }
}
