{
  "contract": "melo.asset-manifest",
  "contractVersion": "1.0.0",
  "id": "hud.score",
  "version": "1.0.0",
  "kind": "ui-theme",
  "origin": "builtin",
  "contentHash": "sha256:39e9dca88093bb07f91978a0fe1b60290070644ca3d57cd08b3b84d3c4d19749",
  "runtime": {
    "renderers": [
      "fixed-camera-cinematic"
    ],
    "deterministic": true
  }
}
